155024,201511010076,2015,11,1,,0,,217,United States,1,North America,Mississippi,Tupelo,34.308638,-88.709435,1.0,0,The incident occurred on North Gloster street.,"11/01/2015: An assailant threw an explosive device at a Walmart in Tupelo, Mississippi, United States. There were no reported casualties in the blast. An individual, identified as Marshall E. Leonard, claimed responsibility for the incident. Sources posited that Leonard targeted the Walmart because it stopped selling Mississippi state flags containing the Confederate flag symbol.",1,1,1,0,,,0,1,0,3,Bombing/Explosion,,,,,1,Business,7.0,Retail/Grocery/Bakery,Walmart,Store,217.0,United States,,,,,,,,,,,,,,,,,Right-wing extremists,,,,,,"The specific motive is unknown; however, sources posited that Marshall E. Leonard targeted the Walmart because it stopped selling Mississippi state flags containing the Confederate flag symbol.",0.0,,,1,1.0,1.0,1.0,7.0,"Posted to website, blog, etc.",,,,,,,,6,Explosives,17.0,Other Explosive Type,,,,,,,,,,,,,A homemade explosive device wrapped in newspaper was used in the attack.,0.0,0.0,0.0,0.0,0.0,0.0,-9,,,,It is unknown if any property was damaged in this attack.,0.0,,,,,,,,,,,,,,,,,"""Confederate-Flag Sympathizer Tries to Bomb Mississippi Walmart for Being 'Anti-American' Fortunately, the homemade device fizzled out in the lobby.,"" New York Magazine, November 3, 2015.","""Mississippi Flag Supporter Arrested For Detonating Bomb At Walmart Store,"" International Business Times, November 3, 2015.","""Mississippi Flag Supporter Accused of Bombing Walmart,"" Newser, November 3, 2015.",START Primary Collection,-9,-9,0,-9,
155123,201511040056,2015,11,4,,0,,217,United States,1,North America,California,Merced,37.312127,-120.472886,1.0,0,,"11/04/2015: An assailant attacked students on the University of California campus in Merced, California, United States. Four students were injured in the attack. The assailant was shot and killed by police officers. Faisal Mohammad claimed responsibility in a note left at the scene.",1,1,1,0,,,0,1,0,2,Armed Assault,,,,,8,Educational Institution,49.0,School/University/Educational Building,"University of California, Merced",Campus,217.0,United States,,,,,,,,,,,,,,,,,Jihadi-inspired extremists,,,,,,,0.0,,,1,1.0,0.0,1.0,5.0,Note left at scene,,,,,,,,9,Melee,23.0,Knife or Other Sharp Object,,,,,,,,,,,,,A knife was used in the attack.,1.0,1.0,1.0,4.0,4.0,0.0,0,,,,,0.0,,,,,,,,,,,,,,,,,"""Attacker who stabbed students at UC Merced had ISIS flag, FBI says,"" CNN, March 18, 2016.","""ISIS goes global: Mapping attacks,"" CNN, December 29, 2015.","""FBI: ISIS inspired California student in campus stabbings,"" CBS News, March 17, 2016.",START Primary Collection,-9,-9,0,-9,
155196,201511060053,2015,11,6,,0,,217,United States,1,North America,California,Ingelwood,33.959535,-118.348342,1.0,0,The incident occurred in Los Angeles county.,"11/06/2015: An assailant attacked a Sikh bus driver in Inglewood, California, United States. The driver, identified as Balwinder Jit Singh, was injured in the attack. An individual identified as K.C. Tard Jr. claimed responsibility for the incident and called Singh a ""terrorist"" and a ""suicide bomber.""",1,1,1,0,,,0,1,0,8,Unarmed Assault,,,,,14,Private Citizens & Property,69.0,Religion Identified,Not Applicable,Sikh Civilian: Balwinder Jit Singh,217.0,United States,,,,,,,,,,,,,,,,,Anti-Sikh extremists,,,,,,"An individual, identified as KC Tard Jr., claimed responsibility for the incident and described Balwinder Jit Singh as a ""terrorist"" and a ""suicide bomber.""",0.0,,,1,1.0,1.0,1.0,8.0,Personal claim,,,,,,,,9,Melee,22.0,"Hands, Feet, Fists",,,,,,,,,,,,,,0.0,0.0,0.0,1.0,1.0,0.0,0,,,,,0.0,,,,,,,,,,,,,,,,,"""Man is charged in racially motivated attack on Sikh Metro bus driver, prosecutors say,"" Los Angeles Times, March 3, 2016.","""Sikh bus driver says police didn't recognize hate crime,"" Associated Press, January 15, 2016.","""'Hate crime evidence': Sikh advocacy group criticizes LA authorities over bus driver attack,"" UAE NewsApp.com, January 15, 2016.",START Primary Collection,-9,-9,0,-9,
155556,201511150043,2015,11,15,,0,,217,United States,1,North America,Connecticut,Meriden,41.519714,-72.840257,1.0,0,The incident occurred along Main Street.,"11/15/2015: Assailants opened fire on the Baitul Aman Mosque on Main Street in Meriden, Connecticut, United States. There were no reported casualties, though the mosque was damaged in the attack. No group claimed responsibility for the incident; however authorities identified the assailant as Ted Hakey Junior, who confessed to the attack.",1,1,1,0,,,0,1,0,2,Armed Assault,,,,,15,Religious Figures/Institutions,86.0,Place of Worship,Baitul Aman Mosque,Mosque,217.0,United States,,,,,,,,,,,,,,,,,Anti-Muslim extremists,,,,,,"The specific motive is unknown; however, sources suspected that the attack may have been part of a larger trend of violence targeting members of the Muslim community following the Paris attacks.",0.0,,,1,1.0,1.0,1.0,8.0,Personal claim,,,,,,,,5,Firearms,2.0,Automatic or Semi-Automatic Rifle,5.0,Firearms,3.0,Handgun,,,,,,,,,An M14 rifle and a 9-mm handgun were used in the attack.,0.0,0.0,0.0,0.0,0.0,0.0,1,3.0,Minor (likely < $1 million),-99.0,A building was damaged in this attack.,0.0,,,,,,,,,,,,,,,,,"""Ex-Marine Pleads Guilty in Meriden Mosque Shooting,"" NBC Connecticut, February 11, 2016.","""Police, FBI investigate shots fired at Meriden mosque,"" San Francisco Chronicle, November 17, 2015.","""FBI Investigating Bullets Fired at Meriden Mosque: Police,"" NBC Connecticut, November 17, 2015.",START Primary Collection,-9,-9,0,-9,
155717,201511190054,2015,11,19,,0,,217,United States,1,North America,Virginia,Falls Church,38.861472,-77.146621,1.0,0,,"11/19/2015: An assailant threw incendiary devices at Dar Al-Hijrah Islamic Center in Falls Church, Virginia, United States. There were no reported casualties in the attack. No group claimed responsibility for the incident; however, an individual, identified as Chester H. Gore, was arrested in connection with the attack.",1,1,1,0,,,0,1,0,7,Facility/Infrastructure Attack,,,,,15,Religious Figures/Institutions,86.0,Place of Worship,Dar Al-Hijrah Islamic Center,Mosque,217.0,United States,,,,,,,,,,,,,,,,,Anti-Muslim extremists,,,,,,"The specific motive is unknown; however, sources suspected that the attack may have been part of a larger trend of violence targeting members of the Muslim community following the Paris attacks.",0.0,,,1,1.0,1.0,0.0,,,,,,,,,,8,Incendiary,19.0,Molotov Cocktail/Petrol Bomb,7.0,Fake Weapons,,,,,,,,,,,Molotov cocktails and a fake explosive device were used in the attack.,0.0,0.0,0.0,0.0,0.0,0.0,1,3.0,Minor (likely < $1 million),200.0,A gate at a mosque was damaged in this attack.,0.0,,,,,,,,,,,,,,,,,"""In Solidarity with American Muslims, Norton to Attend Prayer Services at Dar Al-Hijrah Islamic Center, Today,"" Targeted News Service, December 4, 2015.","""Man Left Hoax Explosive Device at Fairfax County Mosque, Officials Say,"" NBC Washington, November 23, 2015.",,START Primary Collection,-9,-9,0,-9,
156000,201511270001,2015,11,27,,0,,217,United States,1,North America,Colorado,Colorado Springs,38.864281,-104.778414,1.0,0,,"11/27/2015: An assailant opened fire on a Planned Parenthood clinic and held an unknown number of people hostage for five hours in Colorado Springs, Colorado, United States. At least three people were killed and nine other people were wounded in the assault. An individual, identified as Robert Lewis Dear, claimed responsibility for the incident and stated that he was a ""warrior for the babies.""",1,1,1,0,,,0,1,0,5,Hostage Taking (Barricade Incident),2.0,Armed Assault,,,5,Abortion Related,40.0,Clinics,"Planned Parenthood Federation of America, Inc.",Clinic,217.0,United States,,,,,,,,,,,,,,,,,Anti-Abortion extremists,,,,,,"An individual, identified as Robert Lewis Dear, claimed responsibility for the incident and stated that he was a ""warrior for the babies.""",0.0,,,1,1.0,1.0,1.0,8.0,Personal claim,,,,,,,,5,Firearms,2.0,Automatic or Semi-Automatic Rifle,,,,,,,,,,,,,An assault rifle was used in the attack.,3.0,3.0,0.0,9.0,9.0,0.0,0,,,,,1.0,-99.0,-99.0,5.0,,,,0.0,,,,,,5.0,Successful Rescue,-99.0,,"""3 Are Dead in Colorado Springs Shootout at Planned Parenthood Center,"" New York Times, November 28, 2015.","""Planned Parenthood Shooting Suspect Robert Dear Says He's 'Warrior for the Babies',"" NBCNews.com, December 9, 2015.","""Shooting near Colorado Planned Parenthood clinic leaves 3 officers injured,"" CBC, November 27, 2015.",START Primary Collection,-9,-9,0,-9,
156320,201512050031,2015,12,5,,0,,217,United States,1,North America,New York,New York City,40.697133,-73.931352,1.0,0,The incident occurred in the Astoria area of Queens.,"12/05/2015: An assailant assaulted a Muslim store clerk at Fatima Food Mart in Queens, New York City, United States. The clerk was injured in the attack. No group claimed responsibility; however, an assailant, identified as Piro Kolvani, said ""I kill Muslims"" during the attack and was later arrested.",1,1,1,0,,,0,1,0,8,Unarmed Assault,,,,,14,Private Citizens & Property,69.0,Religion Identified,Not Applicable,Muslim Civilian,217.0,United States,,,,,,,,,,,,,,,,,Anti-Muslim extremists,,,,,,"The specific motive is unknown; however, sources suspected that the attack may have been part of a larger trend of violence targeting members of the Muslim community following the Paris attacks and the San Bernardino attack. Moreover, sources noted that the assailant said, ""I kill Muslims,"" during the attack.",0.0,,,1,1.0,1.0,0.0,,,,,,,,,,9,Melee,22.0,"Hands, Feet, Fists",,,,,,,,,,,,,,0.0,0.0,0.0,1.0,1.0,0.0,0,,,,,0.0,,,,,,,,,,,,,,,,"Casualty numbers for this incident conflict across sources. Following GTD protocol, the majority reliable estimates are reported here.","""Florida man charged with hate crimes for allegedly attacking Muslim store clerk in Queens,"" New York Daily News, January 4, 2016.","""Man Yells He Wants to 'Kill Muslims,' Attacks Store Owner in NYC: Police, Victim,"" NBC New York, December 10, 2015.","""Advocates fear rise in anti-Muslim attacks after Paris, San Bernardino,"" CBS News, December 10, 2015.",START Primary Collection,-9,-9,0,-9,
156398,201512080038,2015,12,8,,0,,217,United States,1,North America,North Dakota,Grand Forks,47.900053,-97.044649,1.0,0,,"12/08/2015: Assailants set fire to Jubba Cafe, a restaurant owned by a Somali-Muslim, in Grand Forks, North Dakota, United States. There were no reported casualties in the attack, but the building was damaged in the blaze. No group claimed responsibility for the incident; however, sources attributed the attack to an individual identified as Matthew Gust.",1,1,1,0,,,0,1,0,7,Facility/Infrastructure Attack,,,,,1,Business,2.0,Restaurant/Bar/Café,Jubba Cafe,Restaurant,217.0,United States,,,,,,,,,,,,,,,,,Anti-Muslim extremists,,,,,,"The specific motive is unknown; however, sources suspected that the attack may have been part of a larger trend of violence targeting members of the Muslim community following the Paris attacks and the San Bernardino attack.",0.0,,,1,1.0,1.0,0.0,,,,,,,,,,8,Incendiary,18.0,Arson/Fire,,,,,,,,,,,,,,0.0,0.0,0.0,0.0,0.0,0.0,1,3.0,Minor (likely < $1 million),90000.0,A restaurant building was damaged in this attack.,0.0,,,,,,,,,,,,,,,,"Casualty numbers for this incident conflict across sources. Following GTD protocol, the most reliable estimates are reported here.","""Minnesota man arrested for torching Somali restaurant in North Dakota, days after vandal wrote 'go home' and Nazi symbol on wall,"" New York Daily News, December 15, 2015.","""Muslim-owned cafe in US defaced with Nazi graffiti, set ablaze,"" The Express Tribune, December 13, 2015.","""Muslim advocacy group urges FBI probe into possible arson at Juba,"" Grand Forks Herald, December 9, 2015.",START Primary Collection,-9,-9,0,-9,
156498,201512110031,2015,12,11,,0,,217,United States,1,North America,California,Coachella,33.69288,-116.187442,1.0,0,,"12/11/2015: Assailants threw an incendiary device at the Islamic Society of Coachella Valley in Coachella, California, United States. There were no reported casualties, but the mosque was damaged in the attack. No group claimed responsibility for the incident; however, Carl James Dial was arrested in relation to the attack.",1,1,1,0,,,0,1,0,7,Facility/Infrastructure Attack,,,,,15,Religious Figures/Institutions,86.0,Place of Worship,Islamic Society of Coachella Valley,Mosque,217.0,United States,,,,,,,,,,,,,,,,,Anti-Muslim extremists,,,,,,"The specific motive is unknown; however, sources suspected that the attack may have been part of a larger trend of violence targeting members of the Muslim community following the Paris attacks and the San Bernardino attack.",0.0,,,1,1.0,1.0,0.0,,,,,,,,,,8,Incendiary,19.0,Molotov Cocktail/Petrol Bomb,,,,,,,,,,,,,A firebomb was used in the attack.,0.0,0.0,0.0,0.0,0.0,0.0,1,3.0,Minor (likely < $1 million),-99.0,A mosque was damaged in this attack.,0.0,,,,,,,,,,,,,,,,,"""California Mosque Attacked With Molotov Cocktail, Officials Investigate Incident As Hate Crime,"" International Business Times, December 28, 2015.","""Person detained in fire at California mosque,"" USA Today, December 12, 2015.",,START Primary Collection,-9,-9,0,-9,
157472,201601070024,2016,1,7,,0,,217,United States,1,North America,Pennsylvania,Philadelphia,40.008171,-75.135489,1.0,0,The incident occurred at the intersection of 60th and Spruce streets.,"01/07/2016: An assailant shot and injured police officer Jesse Hartnett in Philadelphia, Pennsylvania, United States. Hartnett returned fire and injured the assailant as he attempted to flee. The assailant, identified as Edward Archer, stated that he carried out the attack ""in the name of Islam."" Archer also pledged allegiance to the Islamic State of Iraq and the Levant (ISIL).",1,1,1,0,,,0,1,0,2,Armed Assault,,,,,3,Police,25.0,Police Security Forces/Officers,Philadelphia City Police,Officer: Jesse Hartnet,217.0,United States,,,,,,,,,,,,,,,,,Jihadi-inspired extremists,,,,,,"An unaffiliated individual, identified as Edward Archer, claimed responsibility for the incident and stated that he carried out the attack ""in the name of Islam."" Archer also pledged allegiance to the Islamic State of Iraq and the Levant (ISIL).",0.0,,,1,1.0,1.0,1.0,8.0,Personal claim,,,,,,,,5,Firearms,3.0,Handgun,,,,,,,,,,,,,A semiautomatic pistol was used in the attack.,0.0,0.0,0.0,2.0,2.0,0.0,1,3.0,Minor (likely < $1 million),-99.0,A police vehicle was damaged in this attack.,0.0,,,,,,,,,,,,,,,,,"""Philly Officer Heads Home 2 Weeks After Ambush,"" NBC Philadelphia, January 22, 2016.","""Islamic State sympathiser shoots Philadelphia police officer,"" Telegraph, January 11, 2016.","""Philly cop wounded in street ambush,"" USA Today, January 8, 2016.",START Primary Collection,-9,-9,0,-9,
158835,201602110023,2016,2,11,,0,,217,United States,1,North America,Ohio,Columbus,39.985687,-82.98732,1.0,0,,"02/11/2016: A machete-wielding assailant attacked and wounded four people in Nazareth Restaurant & Deli in Columbus, Ohio, United States. Police shot and killed the assailant after he fled the restaurant. No group claimed responsibility for the incident; however sources identified the assailant as Mohamed Barry, who shouted ""Allahu Akbar"" immediately before the attack.",1,1,1,0,,,0,1,0,2,Armed Assault,,,,,1,Business,2.0,Restaurant/Bar/Café,Nazareth Restaurant & Deli,Restaurant,217.0,United States,,,,,,,,,,,,,,,,,Muslim extremists,,,,,,,0.0,,,1,1.0,0.0,0.0,,,,,,,,,,9,Melee,23.0,Knife or Other Sharp Object,,,,,,,,,,,,,A machete was used in the attack.,1.0,1.0,1.0,4.0,4.0,0.0,0,,,,,0.0,,,,,,,,,,,,,,,,"The victims included Neil McKeein, William Foley, Debbie Russell, and Gerald Russell.","""Columbus machete attack motive,"" CNN, February 12, 2016.","""Random act or Islamist terrorism? Questions linger as Ohio restaurant reopens after machete attack,"" Washington Post, February 16, 2016.","""Ohio Machete attacker Mohamed Barry was investigated by FBI for radical Islamist views,"" One News Page United Kingdom, February 15, 2016.",START Primary Collection,-9,-9,0,-9,
159149,201602180063,2016,2,18,,0,,217,United States,1,North America,Indiana,Nashville,39.207489,-86.246998,1.0,0,,"02/18/2016: An assailant armed with a hatchet attacked Zhang Yue, an 18-year-old Chinese exchange student, in Nashville, Indiana, United States. Yue was injured in the assault. Authorities arrested Dana Ericson, who confessed to the attack, self-identified as a white supremacist, and indicated that his goal was ethnic cleansing. In court Ericson stated that he was ""trying to start a revolution.""",1,1,1,1,4.0,Lack of Intentionality,0,1,0,2,Armed Assault,,,,,14,Private Citizens & Property,71.0,Race/Ethnicity Identified,Not Applicable,Chinese Civilian: Zhang Yue,44.0,China,,,,,,,,,,,,,,,,,White supremacists/nationalists,,,,,,"An unaffiliated individual, identified as Dana Ericson, claimed responsibility for the incident and stated that he targeted Zhang Yue because she was Asian and that he intended to carry out ""ethnic cleansing.""",0.0,,,1,1.0,1.0,1.0,8.0,Personal claim,,,,,,,,9,Melee,23.0,Knife or Other Sharp Object,,,,,,,,,,,,,A hatchet was used in the attack.,0.0,0.0,0.0,1.0,0.0,0.0,0,,,,,0.0,,,,,,,,,,,,,,,,"There is doubt that this incident meets terrorism-related criteria. Sources stated that Ericson had a history of mental illness, and a judge ruled that Ericson was mentally incompetent to stand trial.","""Judge: Nashville man not competent to stand trial,"" Brown County Democrat, April 11, 2016.","""Brown County man not mentally competent to stand trial,"" Indiana Daily Student, April 11, 2016.",,START Primary Collection,-9,-9,1,1,
160675,201603300069,2016,3,30,,0,,217,United States,1,North America,Massachusetts,Tyngsborough,42.691279,-71.438679,1.0,0,The incident occurred around 60 Locust Avenue area of the city,"03/30/2016: An assailant attempted to cut and set fire to power lines in Tyngsborough, Massachusetts, United States. The power lines were not damaged but the device started a fire in the nearby bushes. Danny M. Kelly claimed responsibility for the incident and demanded change within the court system.",1,1,1,0,,,0,1,0,7,Facility/Infrastructure Attack,,,,,21,Utilities,107.0,Electricity,Unknown,Power Lines,217.0,United States,,,,,,,,,,,,,,,,,Court Reform extremists,,,,,,"An unaffiliated individual, identified as Danny M. Kelly, claimed responsibility for the incident and demanded change within the court system.",0.0,,,1,1.0,1.0,1.0,5.0,Note left at scene,,,,,,,,8,Incendiary,18.0,Arson/Fire,,,,,,,,,,,,,Homemade incendiary devices containing thermite were used in the attack.,0.0,0.0,0.0,0.0,0.0,0.0,1,3.0,Minor (likely < $1 million),-99.0,Approximately four acres of land were damaged in this attack.,0.0,,,,,,,,,,,,,,,,,"""Man vowed 'war' in letter left with incendiary devices in Tyngsborough,"" The Boston Globe, April 4, 2016.","""Incendiary Devices Found On Power Lines In Tyngsboro,"" WBZ-TV CBS Boston, March 31, 2016.","""Chelmsford Man Charged with Attempting to Destroy Power Lines in Tyngsborough with Incendiary Device,"" Department of Justice Press Releases, April 4, 2016.",START Primary Collection,-9,-9,0,-9,
163382,201606050082,2016,6,5,,0,,217,United States,1,North America,New York,New York City,40.697133,-73.931352,1.0,0,The incident occurred in the Stapleton area of Staten Island.,"06/05/2016: An assailant threw a Molotov cocktail at St. Paul's Memorial Church in Staten Island, New York City, United States. There were no reported casualties in the attack. No group claimed responsibility for the incident.",1,1,1,0,,,0,1,0,7,Facility/Infrastructure Attack,,,,,15,Religious Figures/Institutions,86.0,Place of Worship,St. Paul's Memorial Church,Episcopal Church,217.0,United States,,,,,,,,,,,,,,,,,Unknown,,,,,,,0.0,,,0,1.0,0.0,0.0,,,,,,,,,,8,Incendiary,19.0,Molotov Cocktail/Petrol Bomb,,,,,,,,,,,,,A Molotov cocktail was used in the attack.,0.0,0.0,0.0,0.0,0.0,0.0,1,3.0,Minor (likely < $1 million),-99.0,A church was damaged in this attack.,0.0,,,,,,,,,,,,,,,,,"""Police Seek Arsonist After Attacks on 2 Staten Island Churches,"" New York Times, June 11, 2016.","""Police probe fire-bombings of 2 Staten Island churches,"" San Francisco Chronicle, June 10, 2016.","""Fire-Bombing Attempt Causes Minor Damage to Historic Church,"" NBC New York, June 6, 2016.",START Primary Collection,-9,-9,0,-9,
163540,201606090034,2016,6,9,,0,,217,United States,1,North America,New York,New York City,40.697133,-73.931352,1.0,0,The incident occurred in the Stapleton area of Staten Island,"06/09/2016: An assailant threw a Molotov cocktail at First Central Baptist Church in Staten Island, New York City, United States. There were no reported casualties in the attack. No group claimed responsibility for the incident.",1,1,1,0,,,0,1,0,7,Facility/Infrastructure Attack,,,,,15,Religious Figures/Institutions,86.0,Place of Worship,Unknown,First Central Baptist Church,217.0,United States,,,,,,,,,,,,,,,,,Unknown,,,,,,,0.0,,,0,1.0,0.0,0.0,,,,,,,,,,8,Incendiary,19.0,Molotov Cocktail/Petrol Bomb,,,,,,,,,,,,,A Molotov cocktail was used in the attack.,0.0,0.0,0.0,0.0,0.0,0.0,1,3.0,Minor (likely < $1 million),-99.0,A church was damaged in this attack.,0.0,,,,,,,,,,,,,,,,,"""Police Seek Arsonist After Attacks on 2 Staten Island Churches,"" New York Times, June 11, 2016.","""Police probe fire-bombings of 2 Staten Island churches,"" San Francisco Chronicle, June 10, 2016.","""Another Staten Island Church Targeted in Fire-Bomb Attempt,"" NBC New York, June 10, 2016.",START Primary Collection,-9,-9,0,-9,
163620,201606120001,2016,6,12,,0,,217,United States,1,North America,Florida,Orlando,28.519601,-81.376794,1.0,0,,"06/12/2016: An assailant armed with an assault rifle and a handgun opened fire on customers at Pulse, a gay nightclub, in Orlando, Florida, United States. The assailant then held an unknown number of people hostage inside the nightclub for three hours. At least 49 people were killed and 53 people were injured during the attack before the assailant was killed by police officers, who also rescued 30 hostages. The assailant, identified as Omar Mateen, had pledged allegiance to the Islamic State of Iraq and the Levant (ISIL). Additionally, Mateen stated that he carried out the attack in retaliation for U.S. airstrikes in Iraq and Syria. The Islamic State of Iraq and the Levant (ISIL) also claimed responsibility for the incident; however, Omar Mateen's connection to ISIL could not be confirmed.",1,1,1,0,,,0,1,0,5,Hostage Taking (Barricade Incident),2.0,Armed Assault,,,1,Business,11.0,Entertainment/Cultural/Stadium/Casino,Pulse Nightclub,Nightclub,217.0,United States,14.0,Private Citizens & Property,67.0,Unnamed Civilian/Unspecified,Not Applicable,Civilians,999.0,Multinational,,,,,,,,,Jihadi-inspired extremists,,,,,,"An unaffiliated individual, identified as Omar Mateen, claimed responsibility for the incident and pledged allegiance to the Islamic State of Iraq and the Levant (ISIL). Additionally, Mateen stated that he carried out the attack in retaliation for United States (US) airstrikes in Iraq and Syria.",0.0,,,1,1.0,0.0,1.0,8.0,Personal claim,,,,,,,,5,Firearms,2.0,Automatic or Semi-Automatic Rifle,5.0,Firearms,3.0,Handgun,,,,,,,,,A Sig Sauer MCX assault rifle and a Glock 17 handgun were used in the attack.,50.0,44.0,1.0,53.0,48.0,0.0,1,3.0,Minor (likely < $1 million),-99.0,The Pulse nightclub sustained unspecified damages in this attack.,1.0,-99.0,-99.0,3.0,,,,0.0,,,,,,6.0,Combination,-99.0,"The victims included Edward Sotomayor Jr., Stanley Almodovar III, Luis Omar Ocasio-Capo, Juan Ramon Guerrero, Eric Ivan Ortiz-Rivera, Peter O. Gonzalez-Cruz, Luis S. Vielma, Kimberly Morris, Eddie Jamoldroy Justice, Darryl Roman Burt II, Deonka Deidra Drayton, Alejandro Barrios Martinez, Anthony Luis Laureanodisla, Jean Carlos Mendez Perez, Franky Jimmy Dejesus Velazquez, Amanda Alvear, Martin Benitez Torres, Luis Daniel Wilson-Leon, Mercedez Marisol Flores, Xavier Emmanuel Serrano Rosado, Gilberto Ramon Silva Menendez, Simon Adrian Carrillo Fernandez, Oscar A Aracena-Montero, Enrique L. Rios, Jr., Miguel Angel Honorato, Javier Jorge-Reyes, Joel Rayon Paniagua, Jason Benjamin Josaphat, Cory James Connell, Juan P. Rivera Velazquez, Luis Daniel Conde, Shane Evan Tomlinson, Juan Chevez-Martinez, Jerald Arthur Wright, Leroy Valentin Fernandez, Tevin Eugene Crosby, Jonathan Antonio Camuy Vega, Jean C. Nives Rodriguez, Rodolfo Ayala-Ayala, Brenda Lee Marquez McCool, Yilmary Rodriguez Solivan, Christopher Andrew Leinonen, Angel L. Candelario-Padro, Frank Hernandez, Paul Terrell Henry, Antonio Davon Brown, Christopher Joseph Sanfeliz, Akyra Monet Murray, and Geraldo A. Ortiz-Jimenez.","""Two Canadians injured in Orlando shooting fear for their lives,"" Montreal Gazette, June 15, 2016.","""Hispanics shaken by heavy toll at Orlando club massacre,"" Reuters, June 14, 2016.","""Orlando nightclub shooting: Casualties confirmed,"" Al Jazeera, June 12, 2016.",START Primary Collection,-9,-9,1,1,
