71747,200101180005,2001,1,18,,0,,217,United States,1,North America,Arizona,Scottsdale,33.494,-111.920694,1.0,0,,"1/18/2001: Arson was set to a luxury home under construction in the  McDowell Sonoran Preserve in Scottsdale, Arizona in the United States, causing significant damage.  There were no casualties in the incident, and the monetary extent of property damage is unknown.  The incident was claimed by the Coalition to Save the Preserves (CSP) in opposition of building and development in the preserved mountain area.  This incident was one in a series of 11 luxury home arsons in the Phoenix area between April 2000 and January 2001.  In June 2001, confessed eco-terrorist Mark Warren Sands was indicted for eight of the arson incidents, pled guilty, and in 2002, was sentenced to 18 years in prison for torching seven luxury homes under construction.",1,1,1,1,2.0,Other Crime Type,0,1,0,7,Facility/Infrastructure Attack,,,,,14,Private Citizens & Property,76.0,House/Apartment/Residence,private residence,"private home in Scottsdale, in the  McDowell Sonoran Preserve area in AZ",217.0,United States,,,,,,,,,,,,,,,,,Coalition to Save the Preserves (CSP),,,,,,Allegedly in opposition of housing sprawl in the Phoenix Desert Mountain Preserve and the McDowell Sonoran Preserve,1.0,,,0,1.0,1.0,1.0,9.0,Other,,,,,,,,8,Incendiary,18.0,Arson/Fire,,,,,,,,,,,,,,0.0,0.0,0.0,0.0,0.0,0.0,1,4.0,Unknown,,"collectively, all eight arsons caused an estimated $5 million in damages",0.0,,,,,,,0.0,,,,,,,,,"Letters sent to media, homeowners and contractors, and messages on construction sites of several of the arsons claimed responsibility in the name of CSP, stating that ""God's work had to be done."" However, during the Federal Grand Jury indictment, prosecutors maintained that Sands committed the acts for his own twisted reasons and the he fabricated letters and claims from the CSP to carry out his plot.  Sands still maintained that he was against development of preserved areas, but also that he ""knew how to sell it,"" ""knew what a god media story was, and ""there was a sense of power"" behind the string of incidents that the media fed on.  The true motives appear to be a combination of personal reasons and to make a broader environmental message, but they remain unknown.  The FBI investigation determined that Sands did in fact fabricate the CSP. The victims of the incidents were fearful or recurring arsons, and according to sources, Sands still  terrorized the community to portray a broader message.","FBI, ""Terrorism 2000/2001,""FBI, DOJ, 2001.","Scott Thomsen, ""Man accused in mountain preserve arsons pleads guilty,"" Associated Press State & Local Wire, November 7, 2001.","""List of Fires in Federal Indictment,"" Associated Press State & Local Wire, June 15, 2001.",Eco Project 2010,0,0,0,0,
73155,200109150005,2001,9,15,,0,,217,United States,1,North America,Texas,Dallas,32.776835,-96.79776,1.0,0,"10819 Elam Rd, Pleasant Grove","09/15/2001: Mark Anthony Stroman shot and killed Waqar Hasan, a Muslim immigrant from Pakistan, in Hasan's convenience store in Dallas, Texas, United States. Stroman, a white supremacist and self-described former member of Aryan Brotherhood, targeted Hasan because he perceived him to be Middle Eastern and intended to retaliate for the recent al Qa'ida attacks in the United States on September 11, 2001. This was the first of three armed assaults carried out by Stroman in less than three weeks. He was arrested on October 5, 2001 and ultimately convicted, sentenced, and executed on July 20, 2011.",1,1,1,0,,,0,1,0,2,Armed Assault,,,,,1,Business,7.0,Retail/Grocery/Bakery,Mom's Grocery,"Waqar Hasan, 46, Muslim immigrant from Pakistan",153.0,Pakistan,,,,,,,,,,,,,,,,,White supremacists/nationalists,,,,,,"Stroman carried out this attack and two others because he believed his victims to be Middle Eastern and that he was acting in retaliation for the recent al Qa'ida attacks on September 11, 2001.",0.0,,,1,1.0,1.0,1.0,8.0,Personal claim,,,,,,,,5,Firearms,5.0,Unknown Gun Type,,,,,,,,,,,,,"The type of firearm used was not specified. Stroman used a shotgun and handgun in this other attacks, and possessed automatic weapons.",1.0,0.0,0.0,0.0,0.0,0.0,0,,,,,0.0,,,,,,,,,,,,,,,,"Stroman reportedly planned at least one additional attack, targeting a mall in Dallas with automatic weapons. Hasan had an open application for permanent residency at the time of his death.","Bill Mears, ""Texas man executed for post-9/11 murder,"" CNN, July 20, 2011.","Dianne Solis, ""Widow, daughters of man slain in 9/11 hate crime in Dallas become Americans,"" Associated Press (Dallas Morning News), March 17, 2012.","Robert E. Pierre, ""Victims of Hate, Now Feeling Forgotten,"" Washington Post, September 14, 2002.",UMD Miscellaneous,-9,-9,1,1,
73156,200109150006,2001,9,15,,0,,217,United States,1,North America,Arizona,Mesa,33.426293,-111.719624,1.0,0,7956 E University Dr,"09/15/2001: Around 2:45 p.m., Frank Silva Roque shot and killed Balbir Singh Sodhi, a Sikh Indian-American immigrant, as Sodhi planted flowers in front of his convenience store in Mesa, Arizona, United States. This was the first in a sequence of three attacks by Roque, who had expressed anti-immigrant and anti-Arab beliefs. He was armed with a .380 caliber handgun and targeted Sodhi because he perceived him to be Arab and intended to retaliate for the recent al Qa'ida attacks in the United States on September 11, 2001. Roque was arrested on September 16, 2001. His insanity defense was not successful; he was ultimately convicted and sentenced to life in prison.",1,1,1,0,,,1,1,0,2,Armed Assault,,,,,1,Business,7.0,Retail/Grocery/Bakery,Mesa Star Chevron Gas Station,"Balbir Singh Sodhi, Indian-American Sikh",217.0,United States,,,,,,,,,,,,,,,,,Anti-Immigrant extremists,,,,,,"Roque carried out this attack and two others because he believed his victims to be Arab and that he was acting in retaliation for the recent al Qa'ida attacks on September 11, 2001.",0.0,,,1,1.0,1.0,1.0,8.0,Personal claim,,,,,,,,5,Firearms,3.0,Handgun,,,,,,,,,,,,,.380 caliber handgun,1.0,1.0,0.0,0.0,0.0,0.0,0,,,,,0.0,,,,,,,,,,,,,,,,,"Tom Lochner, ""Hate Crimes; Former Walnut Creek Resident Slain in Arizona,"" Contra Costa Times, September 17, 2001","""Man Remembers Borhter Killed Days After 9/11; Meets Killer Years Later, Finds Hope and Reconciliation,"" Pittsburgh Post-Gazette, October 2, 2016.","Jacques Billeaud, ""Police: Man killed; second shooting may have been related,"" Associated Press, September 15, 2001.",UMD Miscellaneous,-9,-9,0,-9,"200109150006, 200109150007, 200109150008"
73157,200109150007,2001,9,15,,0,,217,United States,1,North America,Arizona,Mesa,33.426293,-111.719624,1.0,0,,"09/15/2001: Around 3:00 p.m., Frank Silva Roque fired shots through the window of a gas station convenience store staffed by a Lebanese-American man in Mesa, Arizona, United States. This was the second in a sequence of three attacks by Roque, who had expressed anti-immigrant and anti-Arab beliefs. During this drive-by shooting he was armed with a .380 caliber handgun and targeted the store because he perceived the clerk to be Arab and intended to retaliate for the recent al Qa'ida attacks in the United States on September 11, 2001. There were no casualties reported. Roque was arrested on September 16, 2001. His insanity defense was not successful; he was ultimately convicted and sentenced to life in prison.",1,1,1,0,,,1,1,0,2,Armed Assault,,,,,1,Business,7.0,Retail/Grocery/Bakery,Not specified,Unidentified Lebanese-American clerk,217.0,United States,,,,,,,,,,,,,,,,,Anti-Immigrant extremists,,,,,,"Roque carried out this attack and two others because he believed his victims to be Arab and that he was acting in retaliation for the recent al Qa'ida attacks on September 11, 2001.",0.0,,,1,1.0,1.0,1.0,8.0,Personal claim,,,,,,,,5,Firearms,3.0,Handgun,,,,,,,,,,,,,.380 caliber handgun,0.0,0.0,0.0,0.0,0.0,0.0,1,3.0,Minor (likely < $1 million),,There were bullet holes in the window of the store.,0.0,,,,,,,,,,,,,,,,,"Tom Lochner, ""Hate Crimes; Former Walnut Creek Resident Slain in Arizona,"" Contra Costa Times, September 17, 2001","""Man Remembers Borhter Killed Days After 9/11; Meets Killer Years Later, Finds Hope and Reconciliation,"" Pittsburgh Post-Gazette, October 2, 2016.","Jacques Billeaud, ""Police: Man killed; second shooting may have been related,"" Associated Press, September 15, 2001.",UMD Miscellaneous,-9,-9,0,-9,"200109150006, 200109150007, 200109150008"
73158,200109150008,2001,9,15,,0,,217,United States,1,North America,Arizona,Mesa,33.426293,-111.719624,1.0,0,,"09/15/2001: Around 3:15 p.m., Frank Silva Roque shot at the home of an Afghan-American family in Mesa, Arizona, United States. This was the third in a sequence of three attacks by Roque, who had expressed anti-immigrant and anti-Arab beliefs. During this drive-by shooting he was armed with a .380 caliber handgun and targeted the home  because he perceived the family to be Arab and intended to retaliate for the recent al Qa'ida attacks in the United States on September 11, 2001. There were no casualties reported. Roque was arrested on September 16, 2001. His insanity defense was not successful; he was ultimately convicted and sentenced to life in prison.",1,1,1,0,,,1,1,0,2,Armed Assault,,,,,14,Private Citizens & Property,71.0,Race/Ethnicity Identified,Not Applicable,Unidentified Afghan-American family home,217.0,United States,,,,,,,,,,,,,,,,,Anti-Immigrant extremists,,,,,,"Roque carried out this attack and two others because he believed his victims to be Arab and that he was acting in retaliation for the recent al Qa'ida attacks on September 11, 2001.",0.0,,,1,1.0,1.0,1.0,8.0,Personal claim,,,,,,,,5,Firearms,3.0,Handgun,,,,,,,,,,,,,.380 caliber handgun,0.0,0.0,0.0,0.0,0.0,0.0,1,3.0,Minor (likely < $1 million),,,0.0,,,,,,,,,,,,,,,,,"Tom Lochner, ""Hate Crimes; Former Walnut Creek Resident Slain in Arizona,"" Contra Costa Times, September 17, 2001","""Man Remembers Borhter Killed Days After 9/11; Meets Killer Years Later, Finds Hope and Reconciliation,"" Pittsburgh Post-Gazette, October 2, 2016.",,UMD Miscellaneous,-9,-9,0,-9,"200109150006, 200109150007, 200109150008"
73184,200109210001,2001,9,21,,0,,217,United States,1,North America,Texas,Dallas,32.776835,-96.79776,1.0,0,521 S. Buckner Blvd,"09/21/2001: Around 12:30 p.m. Mark Anthony Stroman shot Rais Bhuiyan, a Bangladeshi immigrant who was working at a gas station in Dallas, Texas, United States. Bhuiyan survived a gunshot wound to the head, but was left blind in one eye. Stroman, a white supremacist and self-described former member of Aryan Brotherhood, targeted Bhuiyan because he perceived him to be Middle Eastern and intended to retaliate for the recent al Qa'ida attacks in the United States on September 11, 2001.This was the second of three armed assaults carried out by Stroman in less than three weeks. He was arrested on October 5, 2001 and ultimately convicted, sentenced, and executed on July 20, 2011.",1,1,1,0,,,0,1,0,2,Armed Assault,,,,,1,Business,7.0,Retail/Grocery/Bakery,Buckner Food Mart,"Rais Bhuiyan, 28, Bangladeshi immigrant",19.0,Bangladesh,,,,,,,,,,,,,,,,,White supremacists/nationalists,,,,,,"Stroman carried out this attack and two others because he believed his victims to be Middle Eastern and that he was acting in retaliation for the recent al Qa'ida attacks on September 11, 2001.",0.0,,,1,1.0,1.0,1.0,8.0,Personal claim,,,,,,,,5,Firearms,4.0,Rifle/Shotgun (non-automatic),,,,,,,,,,,,,A double-barrel shotgun.,0.0,0.0,0.0,1.0,0.0,0.0,0,,,,,0.0,,,,,,,,,,,,,,,,"Stroman reportedly planned at least one additional attack, targeting a mall in Dallas with automatic weapons. Bhuiyan was outspoken in his efforts to prevent Stroman's execution. His request made it to the U.S. Supreme Court, where Justice Antonin Scalia turned it down. Bhuiyan became a U.S. citizen in 2010.","Bill Mears, ""Texas man executed for post-9/11 murder,"" CNN, July 20, 2011.","Michael  Graczyk, ""Texas man executed for killing store clerk,"" Lubbock Avalanche-Journal, July 21, 2011.","Robert E. Pierre, ""Victims of Hate, Now Feeling Forgotten,"" Washington Post, September 14, 2002.",UMD Miscellaneous,-9,-9,1,1,
73227,200110040003,2001,10,4,,0,,217,United States,1,North America,Texas,Mesquite,32.767133,-96.599114,1.0,0,3021 Big Town Blvd,"10/04/2001: Mark Anthony Stroman shot Vasudev Patel, a Hindu man from India, who was working at a gas station in Mesquite, Texas, United States. The assailant was armed with a .44-caliber chrome-plated pistol and initially demanded money from the register. When Patel reached for a gun under the counter, Stroman shot the man in the chest. Stroman, a white supremacist and self-described former member of Aryan Brotherhood, targeted Patel because he perceived him to be Middle Eastern and intended to retaliate for the recent al Qa'ida attacks in the United States on September 11, 2001. This was the last of three armed assaults carried out by Stroman in less than three weeks. He was arrested on October 5, 2001 and ultimately convicted, sentenced, and executed on July 20, 2011.",1,1,1,0,,,0,1,0,2,Armed Assault,,,,,1,Business,7.0,Retail/Grocery/Bakery,Shell Gas Station,"Vasudev Patel, 49, Indian-American immigrant",217.0,United States,,,,,,,,,,,,,,,,,White supremacists/nationalists,,,,,,"Stroman carried out this attack and two others because he believed his victims to be Middle Eastern and that he was acting in retaliation for the recent al Qa'ida attacks on September 11, 2001.",0.0,,,1,1.0,1.0,1.0,8.0,Personal claim,,,,,,,,5,Firearms,3.0,Handgun,,,,,,,,,,,,,44-caliber chrome-plated pistol,1.0,1.0,0.0,0.0,0.0,0.0,0,,,,,0.0,,,,,,,,,,,,,,,,"Stroman reportedly planned at least one additional attack, targeting a mall in Dallas with automatic weapons. Patel was a naturalized U.S. citizen.","Bill Mears, ""Texas man executed for post-9/11 murder,"" CNN, July 20, 2011.","Robert E. Pierre, ""Victims of Hate, Now Feeling Forgotten,"" Washington Post, September 14, 2002.",,UMD Miscellaneous,-9,-9,0,-9,
73333,200111050005,2001,11,5,,0,,217,United States,1,North America,Michigan,Houghton,47.117051,-88.544531,1.0,0,,"11/05/2001: Ian Jacob Wallace, acting on behalf of the Earth Liberation Front (ELF) attempted to destroy two forestry buildings at the Michigan Technological University campus by planting two firebombs, made of combustible liquids, ignition sources and timers, outside the buildings. In this case, the building targeted was the U.S. Forest Service Engineering Laboratory. There were no casualties in the incident, nor damages as the devices were found unexploded because the timers failed to trigger the bombs to ignite. The devices were subsequently defused by authorities. The motive was to ""destroy tree research and intimidate the public.""  Wallace pleaded guilty in 2008 to charges for this incident, and was sentenced in 2009, to three years in Federal prison.",1,1,1,0,,,1,0,0,7,Facility/Infrastructure Attack,,,,,8,Educational Institution,49.0,School/University/Educational Building,Michigan Technological University,U.S. Forest Service Engineering Laboratory,217.0,United States,,,,,,,,,,,,,,,,,Earth Liberation Front (ELF),,,,,,"The buildings were being used for researching the genetic engineering of plants, which Wallace believed was detrimental to the environment, and he wanted to deter government agencies and others from supporting this type of research.",0.0,,,0,1.0,1.0,0.0,,,,,,,,,,8,Incendiary,20.0,Gasoline or Alcohol,,,,,,,,,,,,,"An incendiary device made of combustible liquids, ignition sources and timing device",0.0,0.0,0.0,0.0,0.0,0.0,0,,,,,0.0,,,,,,,0.0,,,,,,,,,"Wallace had an accomplice who traveled with him to Houghton to commit the attack, but this person is unknown.","Eric Lindquist, ""Former honor student turns eco-terrorist,"" The Leader-Telegram, October 4, 2009.","""Information Issued by U.S. Attorney's Office for the Western District of Michigan on March 27: Sentencing in 2001 Eco-Terrorism Attempt at Michigan Technological University,"" US Fed News, April 13, 2009.",""" N.Y. Student gets 3 years in prison for eco-crime,"" Associated Press State & Local Wire, March 23, 2009.",Eco Project 2010,0,1,0,1,"200111050005, 200111050006"
73334,200111050006,2001,11,5,,0,,217,United States,1,North America,Michigan,Houghton,47.12186,-88.570024,1.0,0,,"11/05/2001: Ian Jacob Wallace, acting on behalf of the Earth Liberation Front (ELF) attempted to destroy two forestry buildings at the Michigan Technological University campus by planting two firebombs, made of combustible liquids, ignition sources and timers, outside the buildings. In this case the building targeted was the U.J. Noblet Forestry Building. There were no casualties in the incident, nor damages as the devices were found unexploded because the timers failed to trigger the bombs to ignite. The devices were subsequently defused by authorities. The motive was to ""destroy tree research and intimidate the public.""  Wallace pleaded guilty in 2008 to charges for this incident, and was sentenced in 2009, to three years in Federal prison.",1,1,1,0,,,1,0,0,7,Facility/Infrastructure Attack,,,,,8,Educational Institution,49.0,School/University/Educational Building,Michigan Technological University,U.J. Noblet Forestry Building,217.0,United States,,,,,,,,,,,,,,,,,Earth Liberation Front (ELF),,,,,,"The buildings were being used for researching the genetic engineering of plants, which Wallace believed was detrimental to the environment, and he wanted to deter government agencies and others from supporting this type of research.",0.0,,,0,1.0,1.0,0.0,,,,,,,,,,8,Incendiary,20.0,Gasoline or Alcohol,,,,,,,,,,,,,"An incendiary device made of combustible liquids, ignition sources and timing device",0.0,0.0,0.0,0.0,0.0,0.0,0,,,,,0.0,,,,,,,0.0,,,,,,,,,"Wallace had an accomplice who traveled with him to Houghton to commit the attack, but this person is unknown.","Eric Lindquist, ""Former honor student turns eco-terrorist,"" The Leader-Telegram, October 4, 2009.","""Information Issued by U.S. Attorney's Office for the Western District of Michigan on March 27: Sentencing in 2001 Eco-Terrorism Attempt at Michigan Technological University,"" US Fed News, April 13, 2009.",""" N.Y. Student gets 3 years in prison for eco-crime,"" Associated Press State & Local Wire, March 23, 2009.",Eco Project 2010,0,1,0,1,"200111050005, 200111050006"
73613,200201050007,2002,1,5,,0,,217,United States,1,North America,Florida,Tampa,27.947354,-82.45875,1.0,0,The incident occurred at 101 E. Kennedy Blvd.,"1/5/2002: Charles Bishop, a local 15-year-old, stole a Cessna 172R airplane and crashed it into the 28th and 29th floors of the Bank of America Building in downtown Tampa, Florida, United States.  Bishop had written a suicide letter claiming to be sympathetic with the 9/11 highjackers and Osama bin Laden, however there is no evidence that he was connected directly to any terrorist organizations.  Charles Bishop was the only one who died.  There were also no injuries as the building was evacuated before being hit by the plane.",1,1,1,1,2.0,Other Crime Type,0,1,1,4,Hijacking,,,,,1,Business,3.0,Bank/Commerce,Bank of America,Plaza Building,217.0,United States,,,,,,,,,,,,,,,,,Jihadi-inspired extremists,,,,,,"In a suicide note written by Charles Bishop, he states: ""First of all, Osama bin Laden is absolutely justified in the terror he has caused on 9-11. He has brought a mighty nation to its knees! God blesses him and the others who helped make September 11 happen,"" ""The U.S. will have to face the consequences for its horrific actions against the Palestinian people and Iraqis by its allegiance with the monstrous Israelis who want nothing short of world domination. You will pay God help you and I will (underlined) make you pay.  There will be more coming! Al Qaeda and other organizations have met with me several times to discuss the option of me joining. I didn't.  This is an operation done by me only. I had no other help, although I am acting on their behalf.  Osama bin Laden is planning on blowing up the Super Bowl with an antiquated nuclear bomb left over from the 1967 Israeli-Syrian war.""",0.0,,,1,1.0,0.0,1.0,1.0,Letter,,,,,,,0.0,10,"Vehicle (not to include vehicle-borne explosives, i.e., car or truck bombs)",,,,,,,,,,,,,,,Cessna 172R Airplane,1.0,0.0,1.0,0.0,0.0,0.0,-9,4.0,Unknown,,,0.0,,,,,,,,,,,,,,,,There is doubt about Charles Bishop's mental state.  There are claims that his actions were due to psychosis induced by the drug Accutane.,"Brad Smith, ""Skyscraper Hit"", Tampa Tribune, January 6, 2002.","Derek McGinty, ""Charles Bishop crashes plane in Tampa skyscraper, indicates sympathies toward bin Laden"", World News This Morning, January 7, 2002.","Bobbi Harley, ""Charles Bishop crashes plane into Tampa skyscraper"", CBS Evening News, January 6, 2002",UMD Miscellaneous,-9,-9,0,-9,
73741,200202040010,2002,7,4,,0,,217,United States,1,North America,California,Los Angeles,34.097866,-118.407379,1.0,0,,"07/04/2002: Hesham Mohamed Hadayet, an Egyptian-born man, opened fired at the El Al Israeli Airlines ticket counter at the Los Angeles Airport (LAX), killing two people and wounding four others. Hadayet was killed by security personel during the attack. Early reports from police and witnesses recount that Hadayet shot the El Al ticket agent, turned his weapon on passengers in line, was then tackled and subdued by a guard who was reportedly stabbed by Hadayet, and was finally shot at by an El Al security guard. CNN reports that US authorities believed that Hadayet espoused anti-Israeli views, opposed US policies in the Middle East, and conducted the attack in the efforts of being a martyr. The victims of the attack were all reportedly Israeli.",1,1,1,0,,,0,1,0,2,Armed Assault,,,,,6,Airports & Aircraft,44.0,Airport,Los Angeles International Airport,El Al Israeli Airlines at Los Angeles International Airport,97.0,Israel,14.0,Private Citizens & Property,67.0,Unnamed Civilian/Unspecified,Civilians,Passengers and employees of El Al Israeli Airlines in Los Angeles,97.0,Israel,,,,,,,,,Anti-Israeli extremists,,,,,,The perpetrator espoused anti-Israeli views.,0.0,,,1,1.0,1.0,0.0,,,,,,,,,,5,Firearms,3.0,Handgun,9.0,Melee,23.0,Knife or Other Sharp Object,,,,,,,,,,3.0,0.0,1.0,4.0,1.0,0.0,0,,,,,0.0,,,,,,,,,,,,,,,,,"Charles Feldman, ""Los Angeles airport shooting kills 3,"" CNN.com July 5, 2002.","""LAX Guman's apartment searched,"" CBSNews.com, July 5, 2002.",,CETIS,-9,-9,1,1,
74074,200205030007,2002,5,3,,0,,217,United States,1,North America,Iowa,Asbury,42.514446,-90.751516,1.0,0,,"05/03/2002: Between the dates of May 3-7, 2002 eighteen pipe bombs were found in rural mailboxes in five Midwestern states in the U.S.A. collectively causing seven injuries and leading to widespread panic in the region. In the set incidents that occurred on May 3, 2002, seven nearly identical bombs were found by mail carriers and residents in or near mailboxes between 10:49am and 2:30pm in eastern Iowa and western Illinois, including this one in Iowa. Six of the seven bombs detonated, injuring four mail carriers and two residents. Each of the bombs had a note in a plastic bag, which stated, ""I'm obtaining your attention in the only way I can .... more attention-getters are on the way."" On May 7, 2002, the FBI and Nevada state authorities arrested Luke Helder, a 21-year-old college student, who confessed to being responsible for all of the bombs.",1,1,1,1,2.0,Other Crime Type,1,1,0,3,Bombing/Explosion,,,,,14,Private Citizens & Property,67.0,Unnamed Civilian/Unspecified,Civilians,Civilians in the United States Midwest,217.0,United States,2.0,Government (General),,,U.S. Postal Service,US Mail Boxes,217.0,United States,,,,,,,,,Anti-Government extremists,,,,,,The attacks were meant to bring attention to the perpetrator's antigovernment sentiment.,0.0,,,1,1.0,1.0,1.0,8.0,Personal claim,,,,,,,-9.0,6,Explosives,10.0,Pressure Trigger,,,,,,,,,,,,,The pipe bombs were assembled with steel pipes and attached to nine-volt batteries and most were accompanied by antigovernment notes. They were rigged to explode when the mailbox was opened. Only six of the seven devices rigged in this manner detonated.,0.0,0.0,0.0,1.0,1.0,0.0,1,3.0,Minor (likely < $1 million),,Mailboxes were damaged in the attacks.,0.0,,,,,,,,,,,,,,,,,"“Crime: Pipe Bombs Strike Mailboxes in Midwest,” Facts on File World News Digest, May 15, 2002.","“Student, 21, Is Arrested in Nevada in 5-State Bombing Spree.” New York Times¸ May 8, 2002.","“More pipe bombs found in mailboxes throughout Midwest,” ABC News, May 6, 2002.",CETIS,-9,-9,0,-9,"200205030007, 200205030008, 200205030009, 200205030010, 200205030011, 200205030012, 200205030013, 200205030014, 200205040005, 200205040006, 200205040007, 200205040008, 200205040009, 200205040010, 200205040011, 200205060005, 200205060006, 200205070002"
