21464,198403260022,1984,3,26,,0,,217,United States,1,North America,Washington,Everett,47.976575,-122.206419,1.0,0,,"3/26/1984: Curtis Beseda set fire to the Everett Feminist Women's Health Care Center in Everett, Washington, United States.  There were no casualties but the building sustained $10,000 in damages.",1,1,1,0,,,0,1,0,7,Facility/Infrastructure Attack,,,,,5,Abortion Related,40.0,Clinics,,Everett Feminist Women's Health Care Center,217.0,United States,,,,,,,,,,,,,,,,,Anti-Abortion extremists,,,,,,"To protest the practice of abortion and to sabotage abortion facilities operating in Washington.  Specifically, to save the lives of unborn children for the glory of God.",0.0,,,0,1.0,1.0,0.0,,,,,,,,,,8,Incendiary,20.0,Gasoline or Alcohol,,,,,,,,,,,,,Gasoline poured on floor and set on fire,0.0,0.0,0.0,0.0,0.0,0.0,1,3.0,Minor (likely < $1 million),10000.0,,0.0,,,,,,,0.0,,,,,,,,,Curtis Beseda set fires at the same facility on two separate occasions (198312030005 and 198404190011).  Beseda pled guilty and was sentenced to ten years in prison.,"""Man Admits Setting Fires at Abortion Clinics,"" Associated Press, November 10, 1984.","""Bail Set For Suspect in Everett Clinic Fire,"" Eugene Register-Guard, July 21, 1984.","""Abortion Clinic Attacks,"" Washington Post, January 6, 1985.",Anti-Abortion Project 2010,-9,-9,0,-9,
21493,198403280017,1984,3,28,,0,,217,United States,1,North America,Louisiana,New Orleans,29.951027,-90.071422,1.0,0,,,1,1,1,0,,,0,1,0,4,Hijacking,,,,,6,Airports & Aircraft,42.0,Aircraft (not at an airport),Boeing 727 (Delta Flight 357),,217.0,United States,,,,,,,,,,,,,,,,,Black Liberation Army,,,,,,,0.0,,,0,1.0,,,,,,,,,,,,13,Unknown,,,,,,,,,,,,,,,,0.0,,,0.0,,,0,,,,,1.0,26.0,0.0,,,Cuba,Cuba,1.0,5000000.0,,0.0,,,2.0,Hostage(s) released by perpetrators,26.0,,,,,PGIS,0,0,0,0,
21761,198404190011,1984,4,19,,0,,217,United States,1,North America,Washington,Everett,47.976575,-122.206419,1.0,0,,"4/19/1984: Curtis Beseda set fire to the Everett Feminist Women's Health Care Center in Everett, Washington, United States.  There were no casualties but the building sustained $70,000 in damages.",1,1,1,0,,,0,1,0,7,Facility/Infrastructure Attack,,,,,5,Abortion Related,40.0,Clinics,,Everett Feminist Women's Health Care Center,217.0,United States,,,,,,,,,,,,,,,,,Anti-Abortion extremists,,,,,,"To protest the practice of abortion and to sabotage abortion facilities operating in Washington.  Specifically, to save the lives of unborn children for the glory of God.",0.0,,,0,1.0,1.0,0.0,,,,,,,,,,8,Incendiary,20.0,Gasoline or Alcohol,,,,,,,,,,,,,Gasoline fire,0.0,0.0,0.0,0.0,0.0,0.0,1,3.0,Minor (likely < $1 million),70000.0,,0.0,,,,,,,0.0,,,,,,,,,"After the incident, the abortion clinic ceased operation.  Curtis Beseda set fires at the same facility on two separate occasions (198312030005 and 198403260022).  Beseda pled guilty and was sentenced to ten years in prison.","""Man Admits Setting Fires at Abortion Clinics,"" Associated Press, November 10, 1984.","""Bail Set For Suspect in Everett Clinic Fire,"" Eugene Register-Guard, July 21, 1984.","""Abortion Clinic Attacks,"" Washington Post, January 6, 1985.",Anti-Abortion Project 2010,-9,-9,0,-9,
21802,198404220016,1984,4,22,,0,,217,United States,1,North America,Washington,Seattle,47.610786,-122.331306,1.0,0,Third Avenue and Union Street,"04/22/1984: Gary Lee Yarbrough, a member of The Order,  placed a bomb under a seat in a vacant section of the Embassy Theater, an X-rated, pornographic movie house in downtown Seattle, Washington, in the United States, where about twenty to thirty people were sitting, awaiting the movie screening of the night.  Then, another member of The Order, made a warning phone call to the cashier at the theater, but before any precautions could be taken, the bomb exploded, leaving minimal damage, destroying about 10 seats in the theater, and no casualties.  The motive for the bombing was twofold: first, to spread the group's message that pornography was intolerable and second, to act as a diversion for the group's planned armored car robbery the next day (907).",1,1,1,0,,,0,1,0,3,Bombing/Explosion,,,,,1,Business,11.0,Entertainment/Cultural/Stadium/Casino,Embassy Theater,"X-rated, pornographic movie theater in downtown Seattle",217.0,United States,,,,,,,,,,,,,,,,,The Order (Silent Brotherhood),,,,,,"The motive was twofold: first, to send the message that pornography would not be tolerated, and second to use the bombing as a diversionary tactic in order to carry out the group's armored car robbery the next day.",0.0,,,0,1.0,1.0,0.0,,,,,,,,,,6,Explosives,14.0,Time Fuse,,,,,,,,,,,,,"the bomb was made of a high explosive main charge, an Eveready lantern battery, and a Westclox pocket watch timer; the bomb was assembled by Yarbrough himself",0.0,0.0,0.0,0.0,0.0,0.0,1,3.0,Minor (likely < $1 million),-99.0,about 10 seats destroyed,0.0,,,,,,,,,,,,,,,,"Though a phone call was made to warn of the bomb, the group did not claim responsibility or even identify the caller/group over the phone; the explosion occurred at 5:00pm. This is a linked attack with the armored car robbery that followed the next day (198404230019). Though Yarbrough was the one who planted the bomb, Bruce Carroll Pierce, Andrew Virgil Barnhill, Randolph Duey, and Richard H. Kemp, all members of the group, also played active roles in the planning and execution of the bombing, even though many of them were acquitted in this particular case, including Yarbrough.  Gary Lee Yarbrough was convicted in 1985 for the crimes he committed while involved with The Order, and he was sentenced to 80 years. Pierce, Duey, Barnhill, and Kemp, were also convicted, and sentenced to 252 years, 100 years, 40 years and 60 years, respectively for their crimes during their involvement with the group.","Kevin Flynn and Gary Gerhardt, ""The Silent Brotherhood: Inside America's Racist Underground,"" The Free Press, Macmillan Inc., 1989.","""Northwest Digest: Forbes Theater Bombed,"" Tri City Herald, Washington, April 23, 1984.","Mark S. Hamm, ""Terrorism as Crime: From Oklahoma City to Al-Qaeda and Beyond,"" New York University Press, 2007.",Hewitt Project,0,0,0,0,
22160,198405280003,1984,5,28,,0,,217,United States,1,North America,California,San Francisco,37.755363,-122.443352,1.0,0,,"5/28/1984: The Vietnamese Organization to Exterminate Communists and Restore the Nation claimed responsibility for shooting Nguyen Van Luy and his wife Pham Thi Luu in front of their residence in San Francisco, California, United States.  Van Luy, a vocal defender of Vietnam's communist government, was wounded and Thi Luu was killed.",1,1,1,0,,,0,0,0,1,Assassination,,,,,14,Private Citizens & Property,71.0,Race/Ethnicity Identified,Vietnamese-American supporting Vietnam's communist government,Nguyen Van Luy,223.0,Vietnam,,,,,,,,,,,,,,,,,Vietnamese Organization to Exterminate Communists and Restore the Nation,,,,,,To protest supporters of Vietnam's communist government within the American-Vietnamese community.,0.0,,,0,1.0,0.0,1.0,1.0,Letter,,,,,,,,5,Firearms,3.0,Handgun,,,,,,,,,,,,,,1.0,0.0,0.0,1.0,0.0,0.0,0,,,,,0.0,,,,,,,0.0,,,,,,,,,A Vietnamese male was believed to have shot Nyguen Van Luy and his wife.  The Vietnamese Organization to Exterminate Communists and Restore the Nation stated that Van Luy was attacked because he collected money from Vietnamese refugees which he subsequently sent to the Vietnamese government.,"Katherine Bishop, ""Killings of Vietnamese Baffle California Police,"" New York Times, August 25, 1987.","Fox Butterfield, ""The Shifting Picture of Crime by U.S. Vietnamese,"" New York Times, January 21, 1985.","Seth Mydans, ""War Continues for Vietnam Refugees,"" New York Times, August 25, 1989.",Hewitt Project,0,1,1,1,
22322,198406170019,1984,6,17,,0,,217,United States,1,North America,Washington,Seattle,47.610786,-122.331306,1.0,0,,"06/17/1984: A bomb exploded at the Vedanta Society Temple, a Hindu temple is operated by an Indian religious order, in Seattle, Washington in the United States.  The damage was minor and there were no casualties from the blast. Al-Fuqra was responsible for the incident, for which one of the members was later arrested.",1,1,1,0,,,0,1,0,3,Bombing/Explosion,,,,,15,Religious Figures/Institutions,86.0,Place of Worship,Vedanta Society Temple,Hindu temple,217.0,United States,,,,,,,,,,,,,,,,,Jamaat-al-Fuqra,,,,,,Unknown,0.0,,,0,1.0,1.0,0.0,,,,,,,,,,6,Explosives,16.0,Unknown Explosive Type,,,,,,,,,,,,,,0.0,0.0,0.0,0.0,0.0,0.0,1,3.0,Minor (likely < $1 million),-99.0,,0.0,,,,,,,,,,,,,,,,,"""Vedanta Temple Bombed; No One Hurt,"" The Associated Press, June 17, 1984.","Douglas J. Hagmann and CP Investigative Reporter, ""Exposing Terrorists in America: Interim Investigative Report-Jamaat ul-Fuqra: Terrorists in Our Midst?,"" Northeast Intelligence Network, February 12, 2006.","Sean D. Hill with Richard H. Ward, ""Extremist groups: An international compilation of terrorist organizations, violent political groups, and issue-oriented militia movements,""  Office of International Criminal Justice & the Institute for the Study of Violent Groups, 2002.",Hewitt Project,0,1,0,1,
23233,198409090005,1984,9,9,,0,,217,United States,1,North America,Texas,Webster,29.533365,-95.119139,1.0,0,,"9/9/1984: An unidentified male perpetrator attempted to bomb the Clear Lake Women's Center in Webster, Texas, United States.  However, the bomb malfunctioned so he attempted to set the facility on fire.  There were no casualties but the building was damaged.",1,1,1,0,,,0,1,0,3,Bombing/Explosion,7.0,Facility/Infrastructure Attack,,,5,Abortion Related,40.0,Clinics,,Clear Lake Women's Center,217.0,United States,,,,,,,,,,,,,,,,,Anti-Abortion extremists,,,,,,To protest the practice of abortion and to sabotage abortion facilities operating in Texas.,0.0,,,0,1.0,0.0,0.0,,,,,,,,,,6,Explosives,16.0,Unknown Explosive Type,8.0,Incendiary,18.0,Arson/Fire,,,,,,,,,,0.0,0.0,0.0,0.0,0.0,0.0,1,3.0,Minor (likely < $1 million),,,0.0,,,,,,,0.0,,,,,,,,,"This was one of four attacks against health care centers in the Houston area during a three day period (198409070008, 198409080004, and 198409070009).  Authorities believed that the material used to ignite the fire was purchased from the same place as the substance used in 198409070009.","Bonnie Britt, ""Abortion Clinic Bombing Unsolved,"" Houston Chronicle, October 29, 1985.","""Abortion Clinic Attacks,"" Washington Post, January 6, 1985.","""Chronological History of Arsons and Bombings Against Abortion Providers,"" National Abortion Federation.",Anti-Abortion Project 2010,-9,-9,0,-9,
24591,198503160008,1985,3,16,,0,,217,United States,1,North America,California,San Diego,32.715695,-117.161719,1.0,0,Through lobby window,"3/16/1985: Shane Cameron threw a Molotov cocktail into the Birth Control Institute in San Diego, California, United States.  There were no casualties but the building sustained $10,000 in damages.",1,1,1,0,,,0,1,0,7,Facility/Infrastructure Attack,,,,,5,Abortion Related,40.0,Clinics,,The Birth Control Institute,217.0,United States,,,,,,,,,,,,,,,,,Anti-Abortion extremists,,,,,,To protest the practice of abortion and to sabotage abortion facilities operating in California.,0.0,,,0,1.0,1.0,0.0,,,,,,,,,,8,Incendiary,19.0,Molotov Cocktail/Petrol Bomb,,,,,,,,,,,,,Molotov cocktail,0.0,0.0,0.0,0.0,0.0,0.0,1,3.0,Minor (likely < $1 million),10000.0,,0.0,,,,,,,0.0,,,,,,,,,The incident occurred at 10:25 PM.  The same clinic was firebombed seven months earlier (198409130009).,"Dennis Cushman, ""In Firebombing Aftermath All-Night Vigils Begin at Birth Control Clinic,"" Los Angeles Times, March 20, 1985.","Jeffrey Miller, ""Firebomb: Suspect Is Arrested Man Held in Firebombing of Abortion Clinic,"" Los Angeles Times, March 30, 1985.","Jenifer Warren, ""Birth Control Institute Firebombed a Second Time,"" Los Angeles Times, March 18, 1985.",Anti-Abortion Project 2010,-9,-9,0,-9,
24795,198504150003,1985,4,15,,0,,217,United States,1,North America,New York,New York City,40.697132,-73.931351,1.0,0,,,0,1,1,-9,,,0,0,0,8,Unarmed Assault,,,,,9,Food or Water Supply,52.0,Water Supply,,Water Supply serving NYC,217.0,United States,,,,,,,,,,,,,,,,,Unknown,,,,,,,0.0,,,0,1.0,,,,,,,,,,,,3,Radiological,,,,,,,,,,,,,,,Plutonium,0.0,0.0,0.0,0.0,0.0,0.0,0,,,,,0.0,,,,,,,0.0,,,,,,,,,,,,,CBRN Global Chronology,-9,-9,0,-9,
25098,198505150011,1985,5,15,,0,,217,United States,1,North America,California,Berkeley,37.874043,-122.280022,1.0,0,,,1,1,1,0,,,0,1,0,3,Bombing/Explosion,,,,,8,Educational Institution,49.0,School/University/Educational Building,U.C.-Berkeley,"John Hauser, Berkley Graduate Student & Air Force Captain",217.0,United States,,,,,,,,,,,,,,,,,Anti-Technology extremists,,,,,,,0.0,,,1,1.0,,,,,,,,,,,,6,Explosives,16.0,Unknown Explosive Type,,,,,,,,,,,,,Explosive,0.0,,,1.0,,,1,,,,,0.0,,,,,,,0.0,,,,,,,,,,,,,HSI,-9,-9,0,-9,
25434,198506130008,1985,6,13,,0,,217,United States,1,North America,Washington,Auburn,47.307307,-122.228441,1.0,0,,,1,1,1,-9,,,0,1,0,3,Bombing/Explosion,,,,,1,Business,4.0,Multinational Corporation,Boeing,Fabrication Division of Boeing,217.0,United States,,,,,,,,,,,,,,,,,Anti-Technology extremists,,,,,,,0.0,,,1,1.0,,,,,,,,,,,,6,Explosives,9.0,Letter Bomb,,,,,,,,,,,,,Explosive,0.0,0.0,,0.0,0.0,,1,,,,,0.0,,,,,,,0.0,,,,,,,,,,,,,HSI,-9,-9,0,-9,
26657,198511150006,1985,11,15,,0,,217,United States,1,North America,Michigan,Ann Arbor,42.281875,-83.748479,1.0,0,,,1,1,1,0,,,0,1,0,3,Bombing/Explosion,,,,,8,Educational Institution,49.0,School/University/Educational Building,University of Michigan,James McConnell,217.0,United States,,,,,,,,,,,,,,,,,Anti-Technology extremists,,,,,,,0.0,,,1,1.0,,,,,,,,,,,,6,Explosives,9.0,Letter Bomb,,,,,,,,,,,,,Mail bomb,0.0,0.0,0.0,2.0,2.0,0.0,1,,,,,0.0,,,,,,,0.0,,,,,,,,,,,,,HSI,-9,-9,0,-9,
26803,198512020029,1985,12,2,,0,,217,United States,1,North America,Oregon,Portland,45.511795,-122.675629,1.0,0,,"12/2/1985: In a series of four related incidents, an unidentified man sent a letter bomb to the Portland Feminist Women's Health Center in Oregon, United States.  Employees at the abortion facility noticed that the device was suspicious and reported it to authorities.  The letter bomb was subsequently defused.",1,1,1,0,,,1,0,0,3,Bombing/Explosion,,,,,5,Abortion Related,40.0,Clinics,,Portland Feminist Women's Health Center,217.0,United States,,,,,,,,,,,,,,,,,Anti-Abortion extremists,,,,,,"To protest the practice of abortion and to sabotage abortion facilities operating in Oregon.  Specifically, the perpetrator was disgruntled that his girlfriend had received an abortion.",0.0,,,0,1.0,1.0,0.0,,,,,,,,,,6,Explosives,9.0,Letter Bomb,,,,,,,,,,,,,Letter bomb of incendiary nature that was designed to explode upon opening.  It is believed that the device was powerful enough to kill whoever opened it.,0.0,0.0,0.0,0.0,0.0,0.0,0,,,,,0.0,,,,,,,0.0,,,,,,,,,,"Dudley Clendinen, ""Abortion Clinics Are Targets Again,"" New York Times, December 9, 1985.","""Bombs Target Oregon Abortion Agencies,"" Los Angeles Times, December 5, 1985.","""Bombs Mailed To Four Abortion Clinics, Birth Control Agencies,"" Associated Press, December 3, 1985.",Anti-Abortion Project 2010,-9,-9,0,-9,"198512020029, 198512020030, 198512020031, 198512020032"
26804,198512020030,1985,12,2,,0,,217,United States,1,North America,Oregon,Portland,45.511795,-122.675629,1.0,0,"Main post office of Portland, Oregon","12/2/1985: In a series of four related incidents, an unidentified man sent a letter bomb addressed to the Lovejoy SurgiCenter in Portland, Oregon, United States.  The device was discovered at Portland's main post office.  The letter bomb was subsequently defused.",1,1,1,0,,,1,0,0,3,Bombing/Explosion,,,,,5,Abortion Related,40.0,Clinics,,Lovejoy Surgi-Center,217.0,United States,,,,,,,,,,,,,,,,,Anti-Abortion extremists,,,,,,"To protest the practice of abortion and to sabotage abortion facilities operating in Oregon.  Specifically, the perpetrator was disgruntled that his girlfriend had received an abortion.",0.0,,,0,1.0,1.0,0.0,,,,,,,,,,6,Explosives,9.0,Letter Bomb,,,,,,,,,,,,,Letter bomb of incendiary nature that was designed to explode upon opening.  It is believed that the device was powerful enough to kill whoever opened it.,0.0,0.0,0.0,0.0,0.0,0.0,0,,,,,0.0,,,,,,,0.0,,,,,,,,,"This is part of a multiple attack with 198512020029, 198512020031, and 198512020032.  The abortion clinic had previously been the target of many protests and threats.","Dudley Clendinen, ""Abortion Clinics Are Targets Again,"" New York Times, December 9, 1985.","""Bombs Target Oregon Abortion Agencies,"" Los Angeles Times, December 5, 1985.","""Bombs Mailed To Four Abortion Clinics, Birth Control Agencies,"" Associated Press, December 3, 1985.",Anti-Abortion Project 2010,-9,-9,0,-9,"198512020029, 198512020030, 198512020031, 198512020032"
26805,198512020031,1985,12,2,,0,,217,United States,1,North America,Oregon,Portland,45.523062,-122.676482,1.0,0,,"12/2/1985: In a series of four related incidents, an unidentified man sent a letter bomb addressed to the Planned Parenthood clinic in Beaverton, Oregon, United States.  The device was discovered at Portland's main post office.  The letter bomb was subsequently defused.",1,1,1,0,,,1,0,0,3,Bombing/Explosion,,,,,5,Abortion Related,40.0,Clinics,Planned Parenthood,"Planned Parenthood of Beaverton, Oregon",217.0,United States,,,,,,,,,,,,,,,,,Anti-Abortion extremists,,,,,,"To protest the practice of abortion and to sabotage a Planned Parenthood clinic in Oregon.  Specifically, the perpetrator was disgruntled that his girlfriend had received an abortion.",0.0,,,0,1.0,1.0,0.0,,,,,,,,,,6,Explosives,9.0,Letter Bomb,,,,,,,,,,,,,Letter bomb of incendiary nature that was designed to explode upon opening.  It is believed that the device was powerful enough to kill whoever opened it.,0.0,0.0,0.0,0.0,0.0,0.0,0,,,,,0.0,,,,,,,0.0,,,,,,,,,"This is part of a multiple attack with 198512020029, 198512020030, and 198512020032.  The Planned Parenthood facility did not perform abortions.","Dudley Clendinen, ""Abortion Clinics Are Targets Again,"" New York Times, December 9, 1985.","""Bombs Target Oregon Abortion Agencies,"" Los Angeles Times, December 5, 1985.","""Bombs Mailed To Four Abortion Clinics, Birth Control Agencies,"" Associated Press, December 3, 1985.",Anti-Abortion Project 2010,-9,-9,0,-9,"198512020029, 198512020030, 198512020031, 198512020032"
26806,198512020032,1985,12,2,,0,,217,United States,1,North America,Oregon,Forest Grove,45.519015,-123.111169,1.0,0,"Main post office of Portland, Oregon","12/2/1985: In a series of four related incidents, an unidentified man sent a letter bomb addressed to Dr. Peter Bours, a physician who performs abortions in Forest Grove, Oregon, United States.  The device was discovered at Portland's main post office.  The letter bomb was subsequently defused.",1,1,1,0,,,1,0,0,3,Bombing/Explosion,,,,,5,Abortion Related,41.0,Personnel,Physician who performed abortions,Dr. Peter Bours,217.0,United States,,,,,,,,,,,,,,,,,Anti-Abortion extremists,,,,,,"To protest the practice of abortion and to sabotage abortion facilities operating in Oregon.  Specifically, the perpetrator was disgruntled that his girlfriend had received an abortion.",0.0,,,0,1.0,1.0,0.0,,,,,,,,,,6,Explosives,9.0,Letter Bomb,,,,,,,,,,,,,Letter bomb of incendiary nature that was designed to explode upon opening.  It is believed that the device was powerful enough to kill whoever opened it.,0.0,0.0,0.0,0.0,0.0,0.0,0,,,,,0.0,,,,,,,0.0,,,,,,,,,"This is part of a multiple attack with 198512020029, 198512020030, and 198512020031.  Dr. Bours had previously been identified in a New York Times Magazine article as a physician who performs abortions.","""Bombs Target Oregon Abortion Agencies,"" Los Angeles Times, December 5, 1985.","""Bombs Mailed To Four Abortion Clinics, Birth Control Agencies,"" Associated Press, December 3, 1985.",,Anti-Abortion Project 2010,-9,-9,0,-9,"198512020029, 198512020030, 198512020031, 198512020032"
26857,198512110011,1985,12,11,,0,,217,United States,1,North America,California,Sacramento,38.579065,-121.491014,1.0,0,1 outside computer rental store in shopping center in suburb of Sacramento,"12/11/1985:  A pipe bomb exploded outside Ren Tech Computer Rentals, a store located in a shopping center in a suburb of Sacramento, California in the United States.  The explosion killed the owner of the store, Hugh Campbell Scrutton, as the bomb, which was disguised as a package, detonated as Scrutton touched the package that was placed at the rear door of his store.  The perpetrator of this incident was later identified to be Ted Kaczynski, also known as the ""Unabomber."" Kaczynski was responsible for a bombing campaign of over a dozen bombs sent to a number of targets including mostly universities and airlines between 1987 and 1995. He was eventually arrested, charged, and sentenced to life in prison.",1,1,1,0,,,0,1,0,3,Bombing/Explosion,,,,,1,Business,7.0,Retail/Grocery/Bakery,Ren Tech Computer Rentals,"computer rental store in suburb of Sacramento, California",217.0,United States,1.0,Business,7.0,Retail/Grocery/Bakery,Hugh Campbell Scrutton,"Hugh Campbell Scrutton, owner of a computer rental store",217.0,United States,,,,,,,,,Anti-Technology extremists,,,,,,"Kaczynski was responsible for a 17-year bombing campaign of universities, airlines and computer-related targets, as he was against modern technology and large-scale organizations because he believed they diminished human freedom.",0.0,,,1,1.0,1.0,0.0,,,,,,,,,,6,Explosives,9.0,Letter Bomb,,,,,,,,,,,,,"pipe bomb wrapped in paper and tied with strings, made to look like a parcel",1.0,1.0,0.0,0.0,0.0,0.0,1,3.0,Minor (likely < $1 million),-99.0,,0.0,,,,,,,,,,,,,,,,"The explosion occurred at approximately 12:00pm; The perpetrator was later identified as Theodore Kaczynski, known as the ""Unabomber.""  In 1996, he was arrested and indicted for nearly 20 bombings, and the murder of Scrutton as well as 2 others. He was sentenced to life in prison without parole.","""Mystery Bomber Is Hunted in Series of Blasts,"" New York Times, February 20, 1986.","Allan Hall, ""Hermit Caged Over 17-Year Bombing Crusade Against Computer Boffins; FBI agents pounce on hermit Ted Kaczynski yesterday ending their 17-year hunt for the mad bomber who held the US to ransom,"" Scottish Daily Record & Sunday Mail Ltd, New York, April 5, 1996.","""UPI Context: Attacks attributed to serial bomber,"" United Press International, December 20, 1985.",Hewitt Project,-9,-9,0,-9,
26982,198512300008,1985,12,30,,0,,217,United States,1,North America,Ohio,Cincinnati,39.103175,-84.511981,1.0,0,Fire set in basement of building,"12/30/1985: In a series of related attacks, John Brockhoeft ignited a fire at the Margaret Sanger Center of Planned Parenthood in Cincinnati, Ohio, United States.  There were no casualties but the abortion clinic sustained over $75,000 in damages.",1,1,1,0,,,1,1,0,7,Facility/Infrastructure Attack,,,,,5,Abortion Related,40.0,Clinics,Planned Parenthood,Margaret Sanger Center of Planned Parenthood,217.0,United States,,,,,,,,,,,,,,,,,Anti-Abortion extremists,,,,,,To protest the practice of abortion and to sabotage abortion facilities operating in Ohio.,0.0,,,0,1.0,1.0,0.0,,,,,,,,,,8,Incendiary,20.0,Gasoline or Alcohol,,,,,,,,,,,,,Flammable liquid poured on basement floor and ignited on fire.,0.0,0.0,0.0,0.0,0.0,0.0,1,3.0,Minor (likely < $1 million),75000.0,,0.0,,,,,,,0.0,,,,,,,,,"This is part of a multiple incident with (198512300009).  Both attacks occurred around 2:30 AM.  One day later, a fire was set at an abortion clinic in Toledo, Ohio (198512310002).","Sue Cross, ""Arson Suspected In Third Ohio Clinic Fire,"" Associated Press, December 31, 1985.","""Ohio Abortion Clinic Fire 3rd Such Blaze in 2 Days,"" Chicago Sun-Times, January 1, 1986.","""Clinic Fires in Ohio and N.C. Compared,"" Wilmington Morning Star, January 4, 1986.",Anti-Abortion Project 2010,-9,-9,0,-9,"198512300008, 198512300009"
26983,198512300009,1985,12,30,,0,,217,United States,1,North America,Ohio,Cincinnati,39.103175,-84.511981,1.0,0,Fire set in basement of building,"12/30/1985: In a series of related attacks, John Brockhoeft ignited a fire at the Women's Heath Care Center in Cincinnati, Ohio, United States.  There were no casualties but the abortion clinic sustained $75,000 in damages.",1,1,1,0,,,1,1,0,7,Facility/Infrastructure Attack,,,,,5,Abortion Related,40.0,Clinics,,Women's Health Care Center,217.0,United States,,,,,,,,,,,,,,,,,Anti-Abortion extremists,,,,,,To protest the practice of abortion and to sabotage abortion facilities operating in Ohio.,0.0,,,0,1.0,1.0,0.0,,,,,,,,,,8,Incendiary,20.0,Gasoline or Alcohol,,,,,,,,,,,,,Flammable liquid poured on basement floor and ignited on fire.,0.0,0.0,0.0,0.0,0.0,0.0,1,3.0,Minor (likely < $1 million),75000.0,,0.0,,,,,,,0.0,,,,,,,,,"This is part of a multiple incident with (198512300008).  Both attacks occurred around 2:30 AM.  One day later, a fire was set at an abortion clinic in Toledo, Ohio (198512310002).","Sue Cross, ""Arson Suspected In Third Ohio Clinic Fire,"" Associated Press, December 31, 1985.","""Ohio Abortion Clinic Fire 3rd Such Blaze in 2 Days,"" Chicago Sun-Times, January 1, 1986.","""Clinic Fires in Ohio and N.C. Compared,"" Wilmington Morning Star, January 4, 1986.",Anti-Abortion Project 2010,-9,-9,0,-9,"198512300008, 198512300009"
